Title,Yönetmen,Yönetici  yapımcı,Sunucu,Seslendiren(ler),İlişkili programlar,Anlatıcı,Yaratıcı  yönetmen(ler),Besteci,Mekân,Yapım  şirketi,Geliştiren,Açılış müziği,Sezon sayısı,Kamera,Yayın tarihi,Dili,Kurgucu,Yapımcı,Gösterim süresi,Tema müziği bestecisi,Öykü,Sonra gelen,Proje tasarımcısı,Öykü kurgusu,Dağıtımcı firma,Bölüm sayısı,Resim formatı,Platform,Tür,Format,Yazar,Ülke,Ses formatı,Durumu,Kanal,Önce gelen,Uyarlama,Senarist,Bitiş müziği,Görüntü yönetmeni,Başrol
Aşkın Tarifi,Deniz Koloş,,,,,,,"Uğur Akyürek ,  Erman Mete ,  Ersin Bişgen  (1-6) Saki Çimen  (7-13)",İstanbul,NTC Medya,,,1,,7 Haziran 2021 - 6 Eylül 2021,Türkçe,,Mehmet Yiğit Alp,110 dakika,Alp Yenier  (7-13),Leyla Oter Doruk Erengül,,,,,13,576i  ( 16:9 SDTV ) 1080i  ( HDTV ),,Dram Romantik komedi,Televizyon dizisi,,Türkiye,Stereo,Sona erdi,Kanal D,,,Leyla Oter  (1-7) Doruk Erengül  (1-7) Makbule Kosif  (8-13) Okan Başar Bahar  (8-13),,,Kadir Doğulu Serra Arıtürk
Kayıp Şehir,Cevdet Mercan Osman Taşcı,,,,,,,Sezen Aksu,İstanbul,D Productions,,,1,,14 Eylül 2012 - 25 Mart 2013,Türkçe,,Ayşe Durmaz,120 dakika,,,,İrfan Şahin,,,26,576i  ( SDTV ) 1080i  ( HDTV ),,Dram Gerilim,Televizyon dizisi,,Türkiye,Stereo,Sona erdi,Kanal D  ( HD ) (2012-2013),,,Yıldırım Türker Murat Uyurkulak Seray Şahiner Tuğrul Eryılmaz,,,Gökçe Bahadır Nik Xhelilaj İlker Kaleli Nazan Kesal Uğur Polat Cansu Tosun Tugay Mercan Ahmet Mekin Ayta Sözeri
Ustura Kemal,Mustafa Şevki Doğan,,,,,,,,İstanbul,Süreç Film,,,1,,4 Eylül 2012 - 8 Aralık 2012,Türkçe,,Ali Gündoğdu İnci Gündoğdu,90 dakika,Aria,,,,,,14,576i  ( 16:9 SDTV ) 1080i  ( HDTV ),,Dram Tarihî,Televizyon dizisi,,Türkiye,Stereo,Sona erdi.,Show TV  ( HD ),,,Baykut Badem Filiz Ekinci,,,Oktay Kaynarca Naz Elmas Emre Kınay
Ada Masalı,Ali Bilgin  (1-2) Özgür Sevimli  (3-25),,,,,,,Cem Öget,"Kırlangıç Adası ,  İzmir",Ay Yapım,,Buray  - Çift Gökkuşağı,1,,15 Haziran 2021 - 11 Aralık 2021,Türkçe,,Kerem Çatay,130 dakika,Buray,,,,,,25,576i  ( 16:9 SDTV ) 1080i  ( HDTV ),,Romantik komedi Dram,Televizyon dizisi,,Türkiye,Stereo,Sona erdi,Star TV,,,Yelda Eroğlu  (1-9) Yeşim Çıtak  (1-9) Emine Yıldırım  (3-10) Dilek İyigün  (3-10) Aksel Bonfil  (10-20) Ay Yapım  Tasarım Ekibi (21-25),Buray  - Çift Gökkuşağı,,Ayça Ayşin Turan Alp Navruz
"Dedem, Gofret ve Ben",Zeki Alasya,,,,,,,,,,,,1,,2001 - 2001,Türkçe,,Osman Yağmurdereli,,,,,,,,39,,,Komedi Aile,Televizyon dizisi,,Türkiye,,Sona erdi,TRT 1,,,Çetin Büyükakın Alper Erze,,,Zeki Alasya Selma Güneri İclal Aydın Hazım Körmükçü Nejat İşler Barış Küçükgüler Halit Ergenç
Ayrılık,Onur Tan,,,,,,,,,,,,2,,31 Mart 2009 - 16 Şubat 2010,Türkçe,,Çağla Prodüksiyon,,,,,,,,26,4:3,,Aksiyon Dram,Televizyon dizisi,,Türkiye,Stereo,Sona erdi,TRT 1  (2009-2010),,,Sevgi Yılmaz Zeynep Nilüfer Özçelik Redife Zerener Hayri Altunyurt Eren Azak,,,Tuvana Türkay Türkü Hazer Erdal Bilingen
Bizim Ev,İsmail Güneş,,,,,,,,İstanbul,,,,3,,7 Mart 1996 - 1998,Türkçe,,"Sadettin Batu, Mustafa Güneş",,"Cahit Berkay ,  Halit Kakınç",,,,,,101,,,Aile Duygusal Macera,Televizyon dizisi,,Türkiye,,Sona erdi,TGRT,,,Ömer Lütfi Mete,,"Halil Güngör, Ümit Ardabak, Mehmet Gün",Cüneyt Arkın
Çarli,Bülent Özdural  (1-9) Yavuz Boztepe  (10-24),,,,,,,,İstanbul,,,,2,,27 Nisan 1998 - 3 Ekim 1998,Türkçe,,Burçin Özdemir,45 dakika,Erol Temizel,,Çarli İş Başında  (2001),,,,24,4:3,,Komedi,Televizyon dizisi,,Türkiye,Stereo,Sona erdi,Star TV  (1998),,,Nevzat Kitapçı,,Cem Esertepe,Çarli Ercan Diler Berrin Arısoy Melodi Bağcı İlker Aksum Okan Sanlıtop
Not Defteri,Ilgaz Giritlioğlu,Murat Kahraman Özalp,,,,,,Harems,İstanbul,Avşar Film,,,1,,26 Mart 2014  ( 2014-03-26 )  -  25 Haziran 2014  ( 2014-06-25 ),Türkçe,,Şükrü Avşar,100 dakika,,,,,,,13 ( bölümleri listesi ),576i  ( 16:9 SDTV )  1080i  ( HDTV ),,Gençlik,Televizyon dizisi,,Türkiye,Stereo,Yayından kaldırıldı [1],FOX  ( HD ),,Ölü Ozanlar Derneği,Alphan Dikmen   Başak Angigün,,,Fatih Al Ebru Özkan Ekin Mert Daymaz Tarık Özcan Ündüz Beste Kökdemir
Destan,Emir Khalilzadeh  (1-6) Fethi Bayram  (7-27) Metin Günay  (7-27) Ali Aytaç Sakal  (28),,,,,,,Zeynep Alasya Caner Özkan Ertan Özkan,"İstanbul ,  Beykoz",Bozdağ Film,,,2,,23 Kasım 2021 - 15 Eylül 2022,Türkçe,,Mehmet Bozdağ,135 dakika,,Nehir Erdem Ayşe Ferda Eryılmaz,,Mehmet Bozdağ Aslı Zeynep Peker Bozdağ,,,28 ( bölümleri listesi ),576i  ( 16:9 SDTV ) 1080i  ( HDTV ),,Tarihî Kurgu,Televizyon dizisi,,Türkiye,Stereo,Sona erdi,atv,,,Nehir Erdem  (1-21/28)  Ayşe Ferda Eryılmaz  (1-21/28)  İhsan Yıldırım  (22-27)  Eda Karakoç  (22-27)  Mustafa Dinç  (22-27)  Nermin Aslan  (22-27),,Halil Aslan,Ebru Şahin Edip Tepeli Selim Bayraktar
Barbaros Hayreddin: Sultanın Fermanı,Berat Özdoğan,Zeynep Tuna,,,,,,Ender Gündüzlü Metin Arıgül Can Sanıbelli,Antalya Muğla,Es Film,,,1,,23 Aralık 2022 - 9 Haziran 2023,Türkçe,,Yusuf Esenkal Serdar Öğretici,120 dakika,,,,,,,20,576i  ( SDTV 16:9 ) 1080i  ( HDTV ),,Tarihî Kurgu Aksiyon Macera,Televizyon dizisi,,Türkiye,Stereo,Sona erdi,TRT 1,Barbaroslar: Akdeniz'in Kılıcı (2021-2022),,Zülküf Yücel  (1-9) Uğur Uzunok  (10-20) Hamza Akyıldız  (10-20) Abdülhamit Işık  (10-20) Esma Koç  (10-14),,Hakan Dilber,Tolgahan Sayışman Timur Acar Ufuk Özkan Melisa Döngel Arif Pişkin Hasan Küçükçetin Bahadır Yenişehirlioğlu
Ya İstiklal Ya Ölüm,Yasin Uslu,,,,,,,Aytuğ Yargıç,Ankara İstanbul,Kirli Kedi,,,1,,16 Mart 2020 - 20 Nisan 2020,Türkçe,,,120 dakika,,,,,,,12,576i  ( SDTV 16:9 ) 1080i  ( HDTV ),,Tarihî Kurgu,Televizyon dizisi,,Türkiye,Stereo,Sona erdi,TRT 1,,,Funda Çetin,,Barış Yücel,İlker Kızmaz Birkan Sokullu Dolunay Soysert Osman Sonant Mehmet Özgür Rıza Kocaoğlu Hilmi Cem İntepe Melis Sezen
Tetikçinin Oğlu,Yağız Alp Akaydın Emre Aybek,,,,,,,Atakan Ilgazdağ,"Bodrum ,  Muğla",O3 Medya Same Film,,,1,,11 Nisan 2023 - 6 Haziran 2023,Türkçe,,Saner Ayar Ömer Durak,140 dakika,,,,,,,7,576i  ( 16:9 SDTV ) 1080i  ( HDTV ),,Dram Aksiyon,Televizyon dizisi,,Türkiye,Stereo,Yayından kaldırıldı,FOX,,,Gökhan Horzum,,,Şevket Çoruh Timuçin Esen Genco Özak
Adını Feriha Koydum: Emir'in Yolu,Barış Yöş,,,,,,,ENC,,Medyapım,,Adını Feriha Koydum Jenerik,1,,7 Eylül 2012 - 17 Kasım 2012,Türkçe,,Fatih Aksoy,,,,,,,,13 ( bölümleri listesi ),576i  ( 16:9 SDTV ) 1080i  ( HDTV ),,Dram,Televizyon dizisi,,Türkiye,Stereo,Yayından kaldırıldı,Show TV  (2012)  teve2  (Tekrar),Adını Feriha Koydum  (2011-2012),,Melis Civelek Sırma Yanık,,Sinan Onur,Çağatay Ulusoy Gizem Karaca Furkan Andıç Yusuf Akgün Zeynep Çamcı Metin Çekmez Deniz Uğur Ahu Sungur Sedef Şahin
Aramızda Kalsın,Hatice Memiş  (1-15)  Güzide Balcı  (16-52),,,,,,,Aytuğ Yargıç,"İstanbul ,  Üsküdar ,  Çengelköy",TMC Film,,Aramızda Kalsın Jenerik Müziği,2,,19 Eylül 2013 - 22 Ocak 2015,Türkçe,,Erol Avcı,,Aytuğ Yargıç,,,Selin Tunç,,,52 ( bölümleri listesi ),576i  ( 16:9 SDTV ) 1080i  ( HDTV ),,Aile Dram Komedi,Televizyon dizisi,,Türkiye,Stereo,Sona erdi,Star TV  ( HD ),,,Selin Tunç Melis Başar,Yadigar   ( Yonca Lodi ),,Uğur Yücel Binnur Kaya Gökçe Bahadır Caner Cindoruk Cengiz Bozkurt Ayça Damgacı Uğur Serhan Bilge Şen Hikmet Körmükçü Gamze Karaduman Ferit Aktuğ Ecem Çalık Mert Kurdal Mutlu Güney Tülay Bursa Melis Mutluç Aybars Kartal Özson Özge Özpirinçci Mesut Özkeçeci
Dadı,Fatih Aksoy Ebru Yalçın Yonca Güzelpınar,,,,,,,Hasan Baran,,Medyapım,,,3,,5 Ocak 2001 - 28 Ekim 2002,Türkçe,,Sibel Tuna,45 dakika,,,,,,,61,,,Komedi Sit-com,Televizyon dizisi,,Türkiye,Stereo,Sona erdi.,Show TV  (2001)  Star TV  (2002),,,Erol Hızarcı,,,Gülben Ergen Kenan Işık Haldun Dormen Seray Sever Sinem Kobal İlkay Saran Yaşar Abravaya Gökçe Uzuner Tanju Tuncel Ercan Süt Alp Emre Kököz Altuğ Yücel
8. Gün,Çağrı Vila Lostuvalı,,,,,,,,İstanbul,Ay Yapım,,Toygar Işıklı,1,,19 Mart 2018 - 7 Mayıs 2018,Türkçe,,Kerem Çatay,120 dakika,,,,,,,6,576i  ( 16:9 SDTV ) 1080i  ( HDTV ),,Aksiyon Dram,Televizyon dizisi,,Türkiye,Stereo,Sona erdi,atv,,,Savaş Korkmaz Seda Çalışır Toprak Karaoğlu,Toygar Işıklı,,Burcu Biricik Musa Uzunlar Buğra Gülsoy Ceyda Düvenci Cem Davran Yiğit Kirazcı Hakan Kurtaş Gökçe Yanardağ Sermet Yeşil
Fırat,İbrahim Tatlıses,,,,,,,,,,,,1,,1997 - 1998,Türkçe,,,,,,,,,,34,,,Drama,Televizyon dizisi,,Türkiye,,Sona erdi,Star TV,,,,,,Aydemir Akbaş Gülben Ergen Atilla Pakdemir İbrahim Tatlıses
Kuzey Yıldızı İlk Aşk,Ersoy Güler,,,,,,,Batuhan Fırat,Ordu,Süreç Film,,,2,,14 Eylül 2019 - 15 Mayıs 2021,Türkçe,,Ali Gündoğdu,140 dakika,,,,,,,64 ( bölümleri listesi ),576i  ( 16:9 SDTV ) 1080i  ( HDTV ),,Komedi Romantik,Televizyon dizisi,,Türkiye,Stereo,Sona erdi,Show TV,,,Ersoy Güler,,,İsmail Demirci Aslıhan Güner
Fatmagül'ün Suçu Ne?,Hilal Saral,Ali Yörenç,,,,,,,"İstanbul Alaçatı ,  İzmir",Ay Yapım,,,2,,16 Eylül 2010 - 21 Haziran 2012,Türkçe,,Kerem Çatay,90 dakika,Toygar Işıklı,,,,,,80,576i  ( 16:9 SDTV ) 1080i  ( HDTV ),,Dram,Televizyon dizisi,,Türkiye,Stereo,Sona erdi,Kanal D  ( HD ),,Fatmagül'ün Suçu Ne? – Vedat Türkali,Ece Yörenç Melek Gençoğlu,,,Beren Saat Engin Akyürek
Kızlar Yurdu,Kartal Tibet (1-19) Taner Akvardar (20-26),,,,,,,,"Üsküdar ,  İstanbul",Arajans,,Kızlar Yurdu Jenerik,1,,1 Şubat 1992 - 27 Temmuz 1992,Türkçe,,Güner Namlı,40 dakika,Özkan Turgay,,,,,,26,4:3,,Aile Komedi,Televizyon dizisi,,Türkiye,Stereo,Sona erdi,Teleon,,,Ayfer Tunç,,Tangör Toydemir Güngör Toydemir,Perran Kutman Alev Emre Ali Berge Özdemir Han Ali Karagöz Anıl Dalgıç
Yüksek Sosyete,Metin Balekoğlu (1-8. bölüm) Feride Kaytan (8-26. bölüm),,,,,,,,İstanbul,Bi Yapım,,,1,,16 Haziran 2016 - 24 Aralık 2016,Türkçe,,Burak Sağyaşar,120 dakika,,,,,,,26,576i  ( 16:9 SDTV ) 1080i  ( HDTV ),,Romantik komedi,Televizyon dizisi,,Türkiye,Stereo,Sona erdi,Star TV,Kiralık Aşk  (2015-2017),,Meriç Acemi,,,Hazar Ergüçlü Engin Öztürk Meriç Aral Ozan Dolunay Zuhal Olcay
Sevda Çiçeği,Tevfik Şenol Kartal Çidamlı,,,,,,,,İstanbul,Süreç Film,,Ali Otyam,1,,19 Haziran 2006 - 8 Aralık 2006,Türkçe,,İnci Kırhan Ali Gündoğdu,,Ali Otyam,,,,,,24,4:3,,Romantik komedi,Televizyon dizisi,,Türkiye,Stereo,Sona erdi,Show TV,,,Özgür Evren Heptürk,,,Gökhan Özen Yasemin Hadivent Savaş Dinçel Halit Akçatepe Gül Onat Ebru Karanfilci Meral Kaplan Pakize Suda Ercü Turan Serdal Genç Engin Günay Başak Koç İbrahim Gündoğan Elif Burgaz
Cinayet,Serdar Akar Sadullah Şentürk,,,,Forbrydelsen  ( Danimarka ) The Killing  ( ABD ),,,Frans Bac,İstanbul,Adam Film Akbel Film,,,1,,7 Ocak 2014  ( 2014-01-07 )  -  9 Şubat 2014  ( 2014-02-09 ),Türkçe,,Tarkan Karlıdağ Cansu Akbel,80 dakika,,,,,,,5,576i  ( 16:9 SDTV ) 1080i  ( HDTV ),,Polisiye Suç,Televizyon dizisi,,Türkiye,Stereo,Yayından kaldırıldı,Kanal D  ( HD ),,,Ercan Mehmet Erdem,,,Nurgül Yeşilçay Engin Altan Düzyatan Uğur Polat Şükran Ovalı Ahmet Mümtaz Taylan Goncagül Sunar
Çocuk,Serkan Birinci,,,,,,,,"İstanbul ,  Bakırköy",1441 Productions,,,1,,9 Eylül 2019 - 28 Ocak 2020,Türkçe,,İrfan Şahin Cengiz Deveci,120 dakika,,Nazlı Sunlu Kaçan,,,,,18,576i  ( 16:9 SDTV ) 1080i  ( HDTV ),,Dram Aile,Televizyon dizisi,,Türkiye,Stereo,Sona erdi,Star TV,,,Nazlı Sunlu Kaçan Hilal Yıldız,,Barış Milan,Nazan Kesal İsmail Hacıoğlu Serhat Teoman Merve Çağıran Ceyda Ateş Toplusoy Kenan Acar Mehmet Emin Güney
Kardeş Çocukları,Faruk Teber,,,,,,,Aytekin Ataş,İstanbul,Gold Film,,Kardeş Çocukları Jenerik,2,,27 Ocak 2019 - 8 Ekim 2019,Türkçe,,Faruk Turgut,130 dakika,,,,,,,21,576i  ( 16:9 SDTV ) 1080i  ( HDTV ),,Dram,Televizyon dizisi,,Türkiye,Stereo,Sona erdi,Star TV,,,Sırma Yanık,,Eyüp Boz,Mehmet Aslantuğ Ayça Bingöl Nur Fettahoğlu Afra Saraçoğlu Alara Turan Furkan Andıç Berkay Hardal
Kehribar,Yıldız Hülya Bilban,,,,,,,,Bursa,Süreç Film,,,1,,18 Mart 2016 - 24 Haziran 2016,Türkçe,,Ali Gündoğdu,120 dakika,,,,Pınar Bulut,,,15,576i  ( 16:9 SDTV ) 1080i  ( HDTV ),,Aksiyon Dram,Televizyon dizisi,,Türkiye,Stereo,Sona erdi,atv,,,Sinan Tuzcu Ali Aydın,,Efe Kubilay,Gürkan Uygun Ayça Varlıer Necip Memili
Aşk Mantık İntikam,"Murat Öztürk  (1-4, 7-36) Koray Kerimoğlu  (5-6, 37-42)",,,Pelin Çubukçu,,,,Batuhan Fırat  (1-42) Mustafa Güzel  (4-42),İstanbul,No Dokuz Productions,,,1,,18 Haziran 2021 - 22 Nisan 2022,Türkçe,,Yağmur Ünal,120 dakika,Mustafa Erten,,,,,,42 ( bölümleri listesi ),576i  ( 16:9 SDTV ) 1080i  ( HDTV ),,Romantik komedi,Televizyon dizisi,,Türkiye,Stereo,Sona erdi,FOX,,Cunning Single Lady,Özlem İnci Hekimoğlu Nil Güleç Ünsal,,,Burcu Özberk İlhan Şen Melisa Döngel  (1-28) Burak Yörük  (1-28)
Sefirin Kızı,Emre Kabakuşak,,,,,,,Gökhan Kırdar Alp Yenier,Muğla,O3 Medya NGM,,Gökhan Kırdar Alp Yenier,2,,16 Aralık 2019 - 11 Mayıs 2021,Türkçe,,Saner Ayar,120 dakika,Gökhan Kırdar Alp Yenier,,,,,,52,576i  ( 16:9 SDTV ) 1080i  ( HDTV ),,Dram,Televizyon dizisi,,Türkiye,Stereo,Sona erdi,Star TV,,,Ayşe Ferda Eryılmaz (1-34) Nehir Erdem (1-34) Eylem Canpolat (35-52) Ozan Aksungur (35-52),,,Engin Akyürek Neslihan Atagül Tuba Büyüküstün
Yeniden Çalıkuşu,"Cem Akyoldaş  ,  Melih Gülgen",,,,"Çalıkuşu (dizi) Çalıkuşu (film, 1966) Çalıkuşu (roman) Çalıkuşu (dizi, 2013)",,,,İstanbul,Kalinos Prodüksiyon,,,1,,Eylül 2005 - Kasım 2005,Türkçe,,Fırat Gülgen,60 dakika,,,,,,,7 ( bölümleri listesi ),,,Drama,Televizyon dizisi,,Türkiye,Stereo,Sona erdi,Star TV  (2005),,,Hakan Haksun,,,Tuba Ünsal Burak Hakkı Kaan Urgancıoğlu Aliye Uzunatağan Zerrin Arbaş Suna Selen Itır Esen Ahmet Uz Kaya Akarsu Taner Ertürkler
Bir Modern Habil Kabil Hikayesi,Taner Tunç,,,,,,,Yıldıray Gürgen,İstanbul,,,"""Bir Modern Habil Kabil Hikayesi Jenerik""",1,,14 Eylül 2015 - 8 Ekim 2015,Türkçe,,Mustafa Kartal,50 dakika,,,,,,Ser Film,3,576i  ( 16:9 SDTV ) 1080i  ( HDTV ),,Dram,Televizyon dizisi,,Türkiye,Stereo,Sona erdi,Samanyolu TV,,,Şafak Ersavaş Ali Zengin Elif Özdil,,Recep Sevci,Gürkan Günal Sercan Dede
Esir Şehrin Gözyaşları - Bir Ferhat ile Şirin Hikayesi,Çağatay Tosun,,,,,,,,İstanbul,Koliba Film,,,1,,28 Eylül 2012 - 31 Ekim 2012,Türkçe,,Ata Türkoğlu,90 dakika,,,,,,,5,576i  ( 16:9 SDTV ) 1080i  ( HDTV ),,Drama,Televizyon dizisi,,Türkiye,Stereo,Sona erdi,FOX,,,Sevgi Yılmaz,,,Yiğit Özşener Sedef Avcı
Zirvedekiler,Halit Refiğ,,,,,,,,,Erler Film,,,1,,21 Şubat 1995 - 20 Haziran 1995,Türkçe,,Türker İnanoğlu,,,,,,,,18,,,Drama,Televizyon dizisi,,Türkiye,Stereo,Sona erdi,Show TV,,,Safa Önal,,,Cüneyt Arkın Gülşen Bubikoğlu
Ölüm Çiçekleri-Saraybosna,Metin Balekoğlu - Turgut Yasalar,,,,,,,,,,,,1,,21 Mart 2008 - 11 Nisan 2008,Türkçe,,,80 dakika,,,,Cüneyt Özdemir,,,4,,,Dram Savaş,Televizyon dizisi,,Türkiye,,Sona erdi,Star TV  (2008),,,,,,Erhan Emre Zeynep Beşerler
Tozkoparan İskender,Hakan Şahin  (1-5) Bora Onur  (5-26)  Kudret Sabancı  (27-46),Emrah Ömer Kara,,,Uzaktan Erişim  (2020-) Tozkoparan İskender: 1071  (2021) Tozkoparan İskender: Zafer  (2021),,,,İstanbul,Fotoroman Film,,,2,,2 Ocak 2021 - 27 Mart 2022,Türkçe,,Elif Hamamcı,60 dakika,Özgür Zoral,,Tozkoparan İskender: Gölge  (2023-),,,,46 ( bölümleri listesi ),576i  ( 16:9 SDTV ) 1080i  ( HDTV ),,Tarihî Macera Aksiyon Komedi Fantastik,Televizyon dizisi,,Türkiye,Stereo,tabii  platformunda  Tozkoparan İskender: Gölge  olarak devam etmektedir.,TRT 1,Tozkoparan (2018-2020),,Selin Arapkirli Caner Güler,,Cihan Gedik,Çağan Efe Ak Tuana Naz Tiryaki Yağız Kılınç  Leya Kırşan Deniz Erayvaz Berat Efe Parlar Alperen Efe Esmer Zeynep Doğangün
1 Erkek 1 Kadın 2 Çocuk,Leyla Yaman,Mehmetcan Yüksel Melda Perahya Yalçın,,,"Un gars, une fille",,,,İstanbul,Altıoklar  (2008-2009) 1K1E  (2009-2012) Bando Yapım (2012-2015),,,8,Single-camera,2 Ekim 2008 - 8 Nisan 2015,Türkçe,,Mehmet Karaca Müge Turalı,45 dakika,Gaetan Essiambre,,,Guy A. Lepage,Murat Dişli,,416,4:3  ( PAL ),,Durum komedisi,Televizyon dizisi,,Türkiye,Dolby Digital 5.1,Sona erdi,TürkMax  (2008-2011)  Star TV  (2012-2013)  FOX  (2014-2015),,,Ali Alper Erze Hasan Can Kaya Meriç Acemi Utku Gürtunca Sadık Bigat Zeki Enes Akkan,,Sinan Onur,Demet Evgar Emre Karayel
Tatlı Kaçıklar,Aram Gülyüz,,,,,,,,,Erler Film,,,5,,6 Kasım 1996 - 15 Haziran 2001,Türkçe,,Türker İnanoğlu,,,,,,,,165,4:3,,Durum komedisi,Televizyon dizisi,,Türkiye,Stereo,Sona erdi,atv  (1996-2001),,,İhsan Aydın Kemal Kenan Ergen Murat Kürüz Vasıf Küçükoruç Atay Sözer,,,Mehmet Ali Erbil Yalçın Menteş Buket Dereoğlu Neslihan Yeldan Pelin Körmükçü İsmet Ay Erol Günaydın Meltem Cumbul Kayhan Yıldızoğlu Ümit Okur Dursun Ali Sarıoğlu Yıldız Kaplan
Lale Devri,Murat Düzgünoğlu,,,,Yer Gök Aşk  (2010-2013),,,,İstanbul,Avşar Film,,,4,,14 Eylül 2010 - 8 Şubat 2014,Türkçe,,Şükrü Avşar,91 dakika,İskender Paydaş,,,,,,135 ( bölümleri listesi ),576i  ( 16:9 SDTV ) 1080i  ( HDTV ),,Dram,Televizyon dizisi,,Türkiye,Stereo,Sona erdi,Show TV  (2010)  FOX  (2010-2014),,,Eylem Canpolat Sema Ergenekon Banu Tekcan Devrim Yıldız Özdemir,,,Tolgahan Sayışman Selen Soyder Emina Sandal Serenay Sarıkaya Hatice Aslan Kenan Bal Aykut Yılmaz
Dönence,Serdar Gözelekli,,,,,,,JingleTV,İzmir,D Media,,,1,,4 Temmuz 2023 - 11 Ekim 2023,Türkçe,,Ali Cengiz Deveci,120 dakika,,,,,,,14,576i  ( 16:9 SDTV ) 1080i  ( HDTV ),,Romantik Dram Gençlik,Televizyon dizisi,,Türkiye,Stereo,Sona erdi,Kanal D,,Exceptional,S.A yazı Grubu Nuray Uslu Banu Yılmaz Hamza Akyıldız Ebru Hacıoğlu İbrahim Güler Melek Ordu,,,Emre Kınay Caner Topçu Sümeyye Aydoğan Atakan Hoşgören
Sevginin Gücü,Ümit Efekan,,,,,,,,,Erler Film,,,1,,15 Şubat 1994 - 10 Mayıs 1994,Türkçe,,Türker İnanoğlu,,,,,,,,13,,,,Televizyon dizisi,,Türkiye,,Sona erdi,Show TV,,,Safa Önal Erdoğan Tünaş,,Hakan Gürtop,Hülya Avşar Tarık Tarcan Tolga Savacı Maide Erçelebi Bülent Bilgiç
Ihlamurlar Altında,Aydın Bulut,,,,,,,İntizar,İstanbul,Avşar Film,,,2,,16 Eylül 2005 - 29 Haziran 2007,Türkçe,,Şükrü Avşar,100 dakika,İntizar,,,,,,80 ( bölümleri listesi ),,,Dram,Televizyon dizisi,,Türkiye,Stereo,Sona erdi,Kanal D,,,Nilgün Öneş Neslihan Eyüboğlu Ayşe Teker,,,Bülent İnal Tuba Büyüküstün Özge Borak Sinan Tuzcu
Sipahi,Hakan İnan (1-6) Doğan Ümit Karaca (7-8),,,,,,,Seçil Akın,İstanbul Gaziantep Berlin [1],CNP Film,,,1,,12 Aralık 2022 - 30 Ocak 2023,Türkçe,,Mehmet Canpolat Sadi Canpolat,140 dakika,,,,,,,8,576i  ( 16:9 SDTV ) 1080i  ( HDTV ),,Aksiyon İstihbarat,Televizyon dizisi,,Türkiye,Stereo,Sona erdi,Show TV,,,Ali Doğançay,,Hakan Okumuş,Kaan Yıldırım Özge Gürel Kerem Alışık
Sihirli Annem,Ersoy Güler  (2003) Tülay Kocatürk  (2004-2005) Kartal Çidamlı  (2006-2012),,,,2021: Sihirli Annem  (2021-2022),,,Yongün Keymen Tolga Meriç,İstanbul  Ata stüdyoları,Süreç Film,,,7,,27 Şubat 2003 [1]  - 10 Mart 2012,Türkçe,,İnci Kırhan Gündoğdu,"60 dakika (1-4 sezonlar), 90 dakika (5. sezon) 45 dakika (6-7. sezonlar)",,,,Gamze Özer,,,240,4:3,,Fantastik Komedi,Televizyon dizisi,,Türkiye,Stereo,Sona erdi,"Kanal D  (2003-2005, 119 Bölüm) Star TV  (2006, 2011-2012, 121 Bölüm)",,,Gamze Özer,,,İnci Türkay Şahap Sayılgan Defne Joy Foster Zuhal Topal Nevra Serezli Ebru Karanfilci Metin Serezli Gül Onat
Evli ve Öfkeli,,,,,,,,,İstanbul,Süreç Film,,,1,,4 Ekim 2015 - 15 Mayıs 2016,Türkçe,,Ali Gündoğdu,125 dakika,,,,,,,30,576i  ( 16:9 SDTV ) 1080i  ( HDTV ),,Dram,Televizyon dizisi,,Türkiye,Stereo,Sona erdi,atv,,,,,,Ayça Erturan Birce Akalay Yıldız Çağrı Atiksoy Ebru Cündübeyoğlu Sarp Akkaya Burak Sevinç Serkan Altunorak Sinan Eroğlu
Ege'nin Hamsisi,Mustafa Şevki Doğan,,,,,,,Engin Arslan Mayki Murat Başaran,İzmir Rize,Köprü Film,,,1,,16 Temmuz 2018 [1]  - 31 Aralık 2018,Türkçe,,Ferhat Eşsiz,140 dakika,,,,,,,23,576i  ( SDTV ) 1080i  ( HDTV ),,Komedi Aile,Televizyon dizisi,,Türkiye,Stereo,Sona erdi,TRT 1,,,Filiz Ekici Yıldırım Bayazıt,,Kemal Şanlı,İclal Aydın Uğur Çavuşoğlu Uraz Kaygılaroğlu Bestemsu Özdemir
Bir Aile Hikayesi,Merve Girgin Aytekin  (1) Murat Şenöy  (2-18) Murat Öztürk  (3-18),,,,,,,Cem Öget,İstanbul Kars,Medyapım 20th Century Fox Television,Dan Fogelman,Bir Aile Hikayesi Jenerik,2,,9 Mart 2019 - 19 Ekim 2019,Türkçe,,Fatih Aksoy,130 dakika,Uğur Akyürek,,,,,Medyapım 20th Television 20th Century Fox Television Distribution FOX Networks Group Content Distribution Calinos Entertainment 20th Century Fox Television Distribution International Format Productions,18,576i  ( 16:9 SDTV ) 1080i  ( HDTV ),,Dram Aile Komedi,Televizyon dizisi,,Türkiye,Stereo,Sona erdi,FOX,,,Deniz Madanoğlu,Kalbim Seninle Güzel,Hüseyin Tunç,Songül Öden Birkan Sokullu Celil Nalçakan Olgun Toker Elçin Afacan İrem Sak
İstanbullu Gelin,Zeynep Günay Deniz Akçay Katıksız,,,,,,,,Bursa,O3 Medya,,,3,,3 Mart 2017 - 31 Mayıs 2019,Türkçe,,Onur Güvenatam,120 dakika,,Dr.  Gülseren Budayıcıoğlu 'nun romanından,,,,,87 ( bölümleri listesi ),576i  ( 16:9 SDTV ) 1080i  ( HDTV ),,Dram,Televizyon dizisi,,Türkiye,Stereo,Sona erdi,Star TV,,,Teşrik-i Mesai,Cem Tuncer Ercüment Orkut Nail Yurtsever Ercan Tanrısevdi Metin Kalaç,,Özcan Deniz Aslı Enver
Üç Kuruş,Sinan Öztürk,,,,,,,Toygar Işıklı,İstanbul,Ay Yapım,,,1,,1 Kasım 2021 - 30 Mayıs 2022,Türkçe,,Kerem Çatay,120 dakika,,,,,,,28 ( bölümleri listesi ),576i  ( 16:9 SDTV ) 1080i  ( HDTV ),,Aksiyon Dram Polisiye,Televizyon dizisi,,Türkiye,Stereo,Sona erdi,Show TV,,,Damla Serim (1-28) Eset Akçilad (6-28) Murat Uyurkulak  (1-12),,Tolga Kutluay,Uraz Kaygılaroğlu Ekin Koç Diren Polatoğulları Nesrin Cavadzade Aslıhan Malbora Civan Canova Nursel Köse Zafer Algöz Kadir Çermik Bora Akkaş Necip Memili
Beyaz Gelincik,Güzide Balcı,,,,,,,Kıraç,,TMC,,,2,,19 Eylül 2005  ( 2005-09-19 ) [1] [2] [3]  - 11 Haziran 2007,Türkçe,,Erol Avcı,,,,,,,,74 ( bölümleri listesi ),4:3,,Dram,Televizyon dizisi,,Türkiye,Stereo,Sona erdi,atv,,,Sulhi Dölek,,Colin Mounier,Erkan Petekkaya Sezin Akbaşoğulları Altan Erkekli Mehmet Günsür İsmail Hacıoğlu Rana Cabbar
İncir Ağacı,Nuh Şen Hamit Coşkun,,,,,,,,,Sonsuzkare Yapım,,,1,,14 Ekim 2019 - 1 Mayıs 2020,Türkçe,,Mesut Uçakan Hüseyin Türkyıldırır,,,,,,,,140,576i  ( 16:9 SDTV ) 1080i  ( HDTV ),,Dram,Televizyon dizisi,,Türkiye,Stereo,Sona erdi,TRT 1,,,Ayla Hacıoğulları,,,Özlem Güveli Arif Nazım
Benim Güzel Ailem,Sadullah Celen  (1-12) Levent Türkan  (13-22),,,,,,,Aria,İstanbul,Fabrika Yapım,,,1,,21 Haziran 2023 - 6 Aralık 2023,Türkçe,,Öner Arslanel Rodi Kayım,135 dakika,,,,,,,22,576i  ( 16:9 SDTV ) 1080i  ( HDTV ),,Aile Romantik komedi,Televizyon dizisi,,Türkiye,Stereo,Sona erdi,TRT 1,,Once Again,Ayça Mutlugil  (1) Nuray Uslu  (1) Baykut Badem  (1-22),,,Erdal Özyağcılar Onur Buldu Melis Babadağ
Veda Mektubu,Deniz Çelebi Dikilitaş,,,,,,,Güldiyar Tanrıdağlı,İstanbul,Most Production,,,1,,27 Şubat 2023 - 21 Ağustos 2023,Türkçe,,Gül Oğuz,140 dakika,,Deniz Akçay,,,,,24,576i  ( 16:9 SDTV ) 1080i  ( HDTV ),,Dram,Televizyon dizisi,,Türkiye,Stereo,Sona erdi,Kanal D,,,"Deniz Akçay  (1) Armağan Gülşahin  (1, 5-13) Gökhan Atasoy  (1) Mahinur Ergun  (2-4) Yusuf Reha Alp  (2-4) Melih Çam  (2-4) Ayberk Çınar  (9-24) Aslı Gönülay  (9-24) Simge Ayvazoğlu  (9-24)",,,Nurgül Yeşilçay Selim Bayraktar Rabia Soytürk Emre Kıvılcım Bennu Yıldırımlar
Bana Baba Dedi,Bedran Güzel,,,,,,,Murat Boz,İstanbul Beykoz,Acun Medya,,,1,,10 Nisan 2015 - 29 Mayıs 2015,Türkçe,,Acun Ilıcalı,120 dakika,,,,,,,7,576i  ( 16:9 SDTV ) 1080i  ( HDTV ),,Komedi,Televizyon dizisi,,Türkiye,Stereo,Yayından kaldırıldı,TV8  ( HDTV ),,,Dan Berendsen,,Mustafa Nuri Eser,Oğuzhan Koç Eser Yenenler İbrahim Büyükak Yağmur Tanrısevsin Ersin Korkut Cezmi Baskın Ayşe Tunaboylu
Masumiyet,Ömür Atay,,,,,,,Tuna Hizmetli Hakan Yeşilkaya,İstanbul,Gold Film,,,1,,24 Şubat 2021 - 24 Mayıs 2021,Türkçe,,Faruk Turgut,120 dakika,,,,,,,13,576i  ( 16:9 SDTV ) 1080i  ( HDTV ),,Dram Psikolojik gerilim,Televizyon dizisi,,Türkiye,Stereo,Sona erdi,FOX,,,Sırma Yanık,,,Hülya Avşar Mehmet Aslantuğ Deniz Çakır İlayda Alişan Serkay Tütüncü Deniz Işın
Büyük Buluşma,Zeynep Tor [1]  U. Yağmur Yavuz   Naci Çelik Berksoy (-82)   Cem Akyoldaş (83-100)   Ahmet Sönmez (101-107)   Gürsel Ateş (108-115)   Metin Çamurcu (116-123)   Hüdaverdi Yavuz (124-155),,,Hayri Küçükdeniz  (Ümit Acar ve Yusuf Sezgin seslendirmesi),,,,,,Ser Film,,,4,,4 Ekim 2004  ( 2004-10-04 ) [1] [2] [3]  -  27 Haziran 2008  ( 2008-06-27 ) [4] [5],Türkçe,,Ömer Önder  (1-77)   Mustafa Kartal (78-155),90 dakika,Aria,,,,,,155 ( bölümleri listesi ),,,Dram,Televizyon dizisi,,Türkiye,Stereo,Sona erdi,Samanyolu TV,,,"Onur Ünlü  (1-77)   Funda Alp (1-77)   Aziz Aydın   Serkan Birlik (78-115)   Erkan Çıplak (78-88)   Ertan Kurtulan (116-118, 120-155)   Evrim Aytaş (116-118, 120-155)   Ethem Özışık (116-118, 120-131, 141)   Şafak Ersavaş (119)   Hasan Başoğlu (132-140, 142-155)",,,Ümit Acar  (1-36)  Oğuz Oktay [1]  (1-6)   Zeynep Ece Akkoca [1]  (1-6)  Yusuf Sezgin  (37-155)
Annenin Sırrıdır Çocuk,Müge Uğurlar,,,,,,,Atakan Ilgazdağ,İstanbul,NTC Medya,,,1,,6 Nisan 2022 - 15 Haziran 2022,Türkçe,,Fatih Aksoy Mehmet Yiğit Alp,140 dakika,,Makbule Kosif Gülsev Karagöz,,,,,11,576i  ( 16:9 SDTV ) 1080i  ( HDTV ),,Dram,Televizyon dizisi,,Türkiye,Stereo,Sona erdi,TV8,,,Makbule Kosif  (1-8) Gülsev Karagöz  (1-8) Okan Başar Bahar  (1-8) Platin Yazı Grubu  (9-11),,,İrem Helvacıoğlu Selin Yeninci Engin Öztürk Olgun Toker
