Title,Yönetmen,Yönetici  yapımcı,Sunucu,Seslendiren(ler),İlişkili programlar,Anlatıcı,Yaratıcı  yönetmen(ler),Besteci,Mekân,Yapım  şirketi,Geliştiren,Açılış müziği,Sezon sayısı,Kamera,Yayın tarihi,Dili,Kurgucu,Yapımcı,Gösterim süresi,Tema müziği bestecisi,Öykü,Sonra gelen,Proje tasarımcısı,Öykü kurgusu,Dağıtımcı firma,Bölüm sayısı,Resim formatı,Platform,Tür,Format,Yazar,Ülke,Ses formatı,Durumu,Kanal,Önce gelen,Uyarlama,Senarist,Bitiş müziği,Görüntü yönetmeni,Başrol
Sır Dosyası,,,,,,,,,,,,,1,,1999 - 1999,Türkçe,,,,,,,,,,5,576i  ( 16:9 SDTV ),,Polisiye,Televizyon dizisi,,Türkiye,Stereo,Sona erdi,Star TV,,,,,,Taner Birsel Mehmet Günsür Ayça Bingöl Zafer Ergin
Sen de Gitme,Türkan Derya,,,,,,,Dersaadetli,İstanbul,NTC Medya,,Sen de Gitme Jenerik (Açılış),2,,17 Şubat 2011 - 7 Haziran 2012,Türkçe,,Mehmet Yiğit Alp,120 dakika,,,,,,,54 ( bölümleri listesi ),576i  ( 16:9 SDTV ) 1080i  ( HDTV ),,Dram Medikal,Televizyon dizisi,,Türkiye,Stereo,Sona erdi,TRT 1,,,Nuran Evren Şit,Sen de Gitme Jenerik (Bitiş),Burak Demirdelen,Sinan Albayrak Sezin Akbaşoğulları Alican Yücesoy Didem İnselel Miraç Eronat Batuhan Karacakaya
Kaybolan Yıllar,Zeynep Günay Gülçin Gülbahçe,,,,,,,Bolahenk,,Base Productions,,Kaybolan Yıllar-Jenerik,2,,15 Nisan 2006 - 21 Haziran 2007,Türkçe,,Sergin Akyaz,60-70 dakika,,Sergin Akyaz Seçil Akyaz Çolak,,,,,49,576i  ( 16:9 SDTV ) 1080i  ( HDTV ),,Dram Duygusal Polisiye Aşk,Televizyon dizisi,,Türkiye,Stereo,Sona erdi,Star TV  (2006-2007),,,Sergin Akyaz Seçil Akyaz Çolak Makbule Kosif Zehra Güleray,Karanlık Gece,Ercan Durmuş,Yeşim Büber Saruhan Hünel Burak Hakkı
Kızlar Sınıfı,Orhan Elmas,,,,,,,,İstanbul İzmir,Burç Film,,Kızlar Sınıfı Jenerik,1,,18 Mart 1994 - 10 Haziran 1994,Türkçe,,Oğuz Can Turan,40 dakika,Osman Gülcüoğlu Ercan Akdağ,,,,,,13,480i  ( SDTV ),,Komedi Gençlik,Televizyon dizisi,,Türkiye,,Sona erdi,Kanal D,,,Sennur Sezer Aydan Özyalçıner,,,İlyas Salman Ayşen Gruda Gökhan Güney Ergun Köknar İlhan Daner Nilüfer Öz
Hanım Köylü,Mustafa Şevki Doğan,,,,,,,,"Bayırköy ,  Muğla [1] İstanbul",Gold Film,,,1,,23 Nisan 2016 - 1 Ağustos 2016,Türkçe,,Faruk Turgut,120 dakika,,,,,,,13 ( bölümleri listesi ),576i  ( 16:9 SDTV ) 1080i  ( HDTV ),,Aile Romantik komedi,Televizyon dizisi,,Türkiye,Stereo,Sona erdi,Star TV  ( HD ),,,Baykut Badem Filiz Ekinci,,Berkan Öztrak,Yusuf Çim Gülsim Ali Mehmet Özgür Toygan Avanoğlu
Küçük Sırlar,Cevriye Demir,,,,,,,,"Etiler ,  Bebek ,  Beyoğlu ,  Levent ,  Ortaköy ,  İstanbul",Tims Productions,,Teoman  &  Atiye Deniz  - Kal,2,,14 Temmuz 2010 - 2 Eylül 2011,Türkçe,,Timur Savcı,90 dakika (yaklaşık),,,,,,,55,480i 720p 1080i  ( Star TV HD ),,Gençlik Drama,Televizyon dizisi,,Türkiye,Stereo,Sona erdi,Kanal D  (14 Temmuz 2010-20 Kasım 2010)  Star TV  (29 Kasım 2010-2 Eylül 2011),,,Nukret Bıçakçı Aylin Alıveren,,,Sinem Kobal Burak Özçivit Merve Boluğur Birkan Sokullu İpek Karapınar Kadir Doğulu
Balkan Ninnisi,"Doğan Ümit Karaca (1-4) Volkan Kapkın  (1-4) Serdar Akar  (5-10, 21) Selahattin Sancaklı (6-25) Evrim Yöney  (11-25)",,,,,,,,"Üsküp , Kuzey Makedonya",,,,1,,21 Haziran 2022 - 5 Ocak 2023,Türkçe,,Yalçın Arı Uğur Uzunok,,,,,,,,25,576i  ( 16:9 SDTV ) 1080i  ( HDTV ),,Aile Romantik,Televizyon dizisi,,Türkiye,Stereo,Sona erdi,TRT 1,,,Uğur Uzunok Nurullah Sevimli Abdülhamit Işık Esma Koç Baki Türk İdris Meydi Ozan Ayaz Alev Toprakoğlu Hamza Akyıldız,,,Erdal Özyağcılar Özlem Türkad Emre Bey Merih Öztürk Hakan Boyav Suzan Akbelge Can Kolukısa Erman Saban Bedia Begovska
Gülizar,Çağan Irmak,,,,,,,,İzmir,O3 Medya,,,1,,20 Ocak 2018 - 24 Mart 2018,Türkçe,,Onur Güvenatam,120 dakika,,,,,,,10,576i  ( 16:9 SDTV ) 1080i  ( HDTV ),,Dram,Televizyon dizisi,,Türkiye,Stereo,Sona erdi,Kanal D,,,Mahinur Ergun,,,Farah Zeynep Abdullah Berk Cankat Ebru Cündübeyoğlu Şerif Sezer
Sıdıka,Mahinur Ergun Fatmanur Sevinç,,,,,,,,,Delta Film Limon Yapım,,,3,,24 Şubat 1997 - 18 Kasım 2003,Türkçe,Cem Hamamcı,Atıf Yılmaz Sadık Deveci Metin Erarabacı Hayri Aslan,,Atilla Atalay,,,,,,98,4:3,,Komedi,Televizyon dizisi,,Türkiye,Stereo,Sona erdi,Show TV  (1997-2003),,,Atilla Atalay,,Erdal Kahraman,Hasibe Eren Füsun Demirel Ali Erkazan Hakan Tanfer
Parmaklıklar Ardında,Hakan Gürtop (1. sezon)  Nisan Akman  (2 ve 3. sezon),,,,Hinter Gittern - Der Frauenknast,Serra Yılmaz (1  ve 2. sezon),,,Tarihî Sinop Cezaevi [1],,,Aldırma Gönül,3,,13 Aralık 2007 - 24 Haziran 2010,Türkçe,,Ayşe Durukan Uğur Başaran,90 dakika,Kerem Güney,,,,,,106 ( bölümleri listesi ),4:3,,Suç Dram,Televizyon dizisi,Feride Çiçekoğlu Şebnem Çıtak (2. sezon),Türkiye,Stereo,Sona erdi,atv,,,,,,Selda Alkor Serra Yılmaz Yelda Reynaud Özlem Düvencioğlu Zeynep Eronat Sinan Albayrak Cengiz Bozkurt Başak Daşman Pınar Dikici Özgül Kavruk Zehra Alptürk Ogün Kaptanoğlu İsmail Düvenci Onuryay Evrentan Müfide İnselel Zeynep Kızıltan Nurhan Özenen Meltem Pamirtan Iraz Yöntem Pınar Ünsal Beste Bereket Neriman Uğur Dilşad Bozyiğit Mine Çayıroğlu Fikret Kuşkan Rüçhan Çalışkur Zeynep Gülmez Tardu Flordun
Gülümse Kaderine,Aytaç Çiçek,,,,,,,Günay Uysal,İstanbul Bursa,Avşar Film,,,1,,27 Nisan 2022 - 25 Mayıs 2022,Türkçe,,Şükrü Avşar,140 dakika,,,,,,,5,576i  ( 16:9 SDTV ) 1080i  ( HDTV ),,Dram,Televizyon dizisi,,Türkiye,Stereo,Sona erdi,FOX,,,Burcu Över,,,Bahar Şahin Sude Zülal Güler
En Son Babalar Duyar,Sibel Kocataş Funda Karagöz,MinT Motion Pictures,,,,,,,,,,,5,,21 Eylül 2002  ( 2002-09-21 ) [5]  -  30 Aralık 2006  ( 2006-12-30 ),Türkçe,,Birol Güven,,,,,,,,200    ( İlk sezon  TRT 1 'de yayımlandı  . [1] [2] Star TV 'de yayımlanmaya başlayınca bölüm numarası sıfırlanmıştır. 2-5 sezonlar  Star TV 'de yayımlandı .) [3] [4]  ( bölümleri listesi ),480p Çerçeve oranı,,Durum komedisi Aile Dram,Televizyon dizisi,,Türkiye,Stereo,Sona erdi,"TRT 1  (2002-2003,  1. sezon)  Star TV  (2003-2006,  2-5. sezon)",,,Necmi Yapıcı Murat Aras Metin Açıkgöz Birol Güven Kenan Kuzan,,Mustafa Nuri Eser,Ayşegül Atik Ali Erkazan Levent Ülgen Hatice Aslan
Adı Efsane,Devrim Yalçın,Ebru Sakal,,,,,,,İstanbul,D Productions,,,1,,28 Ocak 2017 - 29 Ağustos 2017,Türkçe,,Müge Turalı Pak Elif Ayşe Durmaz,140 dakika,Alpay Göltekin,,,Selim Erkul Duygu Nişancı,,,29,576i  ( 16:9 SDTV ) 1080i  ( HDTV ),,Aşk Dram Gençlik Spor,Televizyon dizisi,,Türkiye,Stereo,Sona erdi,Kanal D,,,Tunus Taşçı Nazlı Sunlu Hilal Yıldız,,Kemal Sözen,Erdal Beşikçioğlu Rojda Demirer Gökçe Bahadır
Karanlıkta Koşanlar,Uğur Yücel,,,,,,,,,TRT,,,1,,2001 - 2001,Türkçe,,Osman Yağmurdereli,,,,,,,,10,,,Macera Polisiye,Televizyon dizisi,,Türkiye,,Sona erdi,TRT 1,,,Ahmet Ümit Uğur Yücel,,,Uğur Yücel Haluk Bilginer Altan Karındaş Köksal Engür Devin Özgür Çınar Parkan Özturan Levend Yılmaz
Adı Sevgi,Sadullah Celen Celil Murat Sarı,,,,,,,Engin Arslan Mayki Murat Başaran Sunay Özgür,İstanbul,Koliba Film,,,1,,13 Mart 2022 - 22 Mayıs 2022,Türkçe,,Ata Türkoğlu,120 dakika,Kalan Müzik,,,,,,11,576i  ( 16:9 SDTV ) 1080i  ( HDTV ),,Dram Aksiyon Gerilim,Televizyon dizisi,,Türkiye,Stereo,Sona erdi,atv,,,Filiz Alpgezmen Murat Can Tura,,Yalçın Yadel,Yunus Emre Yıldırımer Gizem Güneş
Aşk ve Mavi,Hakan Arslan,,,,,,,Alp Yenier,"Ürgüp ,  Nevşehir",NTC Medya,,Aşk ve Mavi,3,Elbruz Eken,4 Kasım 2016 - 16 Kasım 2018,Türkçe,,Mehmet Yiğit Alp,140 dakika,Alp Yenier,,,,,,78,576i  ( SDTV ) 1080i  ( HDTV ),,Dram,Televizyon dizisi,,Türkiye,Stereo,Sona erdi,atv,,,Gül Abus Semerci Yelda Eroğlu,Aşk ve Mavi - Götür Beni Gittiğin Yere,Burak Demirdelen,Emrah  (1-74) Burcu Kıratlı Keremcem Cüneyt Mete Kenan Bal Ayşegül Ünsal Işıl Yücesoy  (1-63)
Ekmek Teknesi,Metin Günay Osman Sınav Gürsel Ateş Sadullah Şentürk,,,,,,,İncesaz,İstanbul Üsküdar Kuzguncuk Beylerbeyi,Sinegraf  (2002-2004) Pana Film  (2004-2005),,,3,Eyüp Boz Yusuf Akkuş,16 Kasım 2002  ( 2002-11-16 ) [1] [2]  -  13 Haziran 2005  ( 2005-06-13 ) [3] [4],Türkçe,,Osman Sınav  (2002-2004) Raci Şaşmaz  (2004-2005),,İncesaz,,Heredot Cevdet Saati  (2015-2016),,,,106,4:3,,Komedi Dram,Televizyon dizisi,,Türkiye,Stereo,Sona erdi,atv  (2002-2004) Show TV  (2004-2005),,,Hasan Kaçan Bahadır Özdener Raci Şaşmaz Elif Aktuğ Mehmet Turgut Ömer Lütfi Mete,,,Savaş Dinçel Sermin Hürmeriç Hasan Kaçan Kadir Çöpdemir Ahmet Yenilmez
Bir Varmış Bir Yokmuş,Bülent İşbilen,,,,,,Nuray Keten Meriç Taşdemir Sedat İnci,Aytekin Ataş,İznik,BKM,,,1,Taylan Çelik İsmail Aydın,7 Ocak 2008 - 28 Ocak 2008,Türkçe,,Necati Akpınar,,,,,,,,4,,,Dram,Televizyon dizisi,,Türkiye,Stereo,Sona erdi,Star TV,,,Meriç Özen Hamdi Döker,,,Ahmet Mekin Onur Ünsal Şahika Koldemir Servet Pandur Serdar Yeğin Türkan Kılıç Erkan Bektaş Turgay Tanülkü Esra Kızıldoğan Burak Davutoğlu Candan Ersoy Erk Bilgiç Ceren Olcayto Selen Öztürk Tuba Erdem Ozan Bilen Sıla Çetindağ Şebnem Gürsoy Bülent İşbilen
Yasak Elma,Neslihan Yeşilyurt (1-74) Murat Öztürk (75-110) Ece Erdek Koçoğlu  (111-177),,,,,,,,İstanbul Hatay,Medyapım,,Yasak Elma Jenerik,6,Dart Prodüksiyon,19 Mart 2018 - 5 Haziran 2023,Türkçe,Serdar Çakular  (1-177)  Kaan Öden  (1-74)  Mert Can Asal  (14-177),Fatih Aksoy,130-150 dakika,Cem Tuncer Ercüment Orkut Efecan Tuncer,,,,,Medyapım  (Türkiye)  Calinos Entertainment (Yurtdışı) [1] [2],177 ( bölümleri listesi ),576i  ( 16:9 SDTV ) 1080i  ( HDTV ),,Dram Komedi,Televizyon dizisi,,Türkiye,Stereo,Sona erdi,FOX,,,Melis Civelek Zeynep Gür,Yasak Elma Jenerik,Erhan Makar  (1-110)  Hakan Dinçkuyucu  (111-177),Şevval Sam Eda Ece Talat Bulut Sevda Erginci Onur Tuna Nesrin Cavadzade Gökhan Alkan Berk Oktay Biran Damla Yılmaz Murat Aygen Barış Kılıç Tuvana Türkay Erdal Özyağcılar Şafak Pekdemir
Sevmek Zamanı,Yıldız Hülya Bilban,,,,,,,Cem Öget Alper Ketenci,İstanbul,Süreç Film,,,1,,20 Haziran 2022 - 18 Temmuz 2022,Türkçe,,Ali Gündoğdu İsmail Gündoğdu,120 dakika,,,,,,,5,576i  ( 16:9 SDTV ) 1080i  ( HDTV ),,Romantik Dram,Televizyon dizisi,,Türkiye,Stereo,Sona erdi,atv,,,Nalan Merter Savaş,,,İlhan Şen Deniz Işın
Yüz Yüze,Osman Taşcı,,,,,,,Toygar Işıklı,İstanbul,Tims&B,,,1,,19 Ekim 2017 - 26 Ekim 2017,Türkçe,,Timur Savcı Burak Sağyaşar,120 dakika,,,,,,,2,576i  ( 16:9 SDTV ) 1080i  ( HDTV ),,Aksiyon Dram,Televizyon dizisi,,Türkiye,Stereo,Yayından kaldırıldı,Show TV  ( HDTV ),,,Ethem Özışık,,Erhan Ergün,Birkan Sokullu Sinem Kobal Taner Ölmez
İkimizin Sırrı,Cem Akyoldaş,,,,,,,,İstanbul,ÜS Yapım,,,1,,8 Ağustos 2021 - 10 Ekim 2021,Türkçe,,Süreyya Yaşar Önal,150 dakika,,,,,,,10,576i  ( 16:9 SDTV ) 1080i  ( HDTV ),,Dram Aşk,Televizyon dizisi,,Türkiye,Stereo,Sona erdi,atv,,Marriage Contract,Özen Yula,,Taylan Sancaktar,Leyla Feray Aras Aydın
EGO,Doğa Can Anafarta  (1-3) Şenol Sönmez  (4-13),,,,,,,Cem Tuncer Ercüment Orkut,İstanbul Antalya [1],Pastel Film,,,1,,5 Şubat 2023 - 21 Mayıs 2023,Türkçe,,Efe İrvül Yaşar İrvül,130 dakika,,,,,,,13,576i  ( 16:9 SDTV ) 1080i  ( HDTV ),,Dram,Televizyon dizisi,,Türkiye,Stereo,Sona erdi,FOX,,Temptation –Ji-Hoon Han,"Gülsev Karagöz (1, 4-13) Zafer Özer Çetinel (1, 4-13) Görkem Tüzün (1, 4-13) Okan Başar Bahar (8-13) Ahmet Orçun Okşar (1, 4-5) Erkan Birgören (2-3) Elif Tuna Kıygı (2-3)",,,Alperen Duymaz Melisa Aslı Pamuk Ahmet Kayakesen Rüya Helin Demirbulut
Muhteşem Yüzyıl,Taylan Biraderler  (1-103) Yağız Alp Akaydın  (104-139) Mert Baykal  (104-139),Nermin Eroğlu,,,,,,Fahir Atakoğlu Aytekin Ataş Soner Akalın,Tims Stüdyoları ( İstanbul ),Tims Productions,,,"4 ( 1 ,  2 ,  3 ,  4 )",,5 Ocak 2011  ( 2011-01-05 )  -  11 Haziran 2014  ( 2014-06-11 ),Türkçe,,Timur Savcı,100-120 dakika,,,Muhteşem Yüzyıl Kösem  (2015-2017),,Emrullah Hekim,,139 ( bölümleri listesi ),576i  ( 16:9 SDTV ) 1080i  ( HDTV ),,Tarihî Kurgu,Televizyon dizisi,,Türkiye,Stereo,Sona erdi,Show TV  ( HD ) (2011) Star TV  ( HD ) (2012-2014),,,Meral Okay  (1-56) Yılmaz Şahin  (57-139),,Aydın Sarıoğlu  (1.sezon) Ercan Özkan  (2.sezon) Burak Kanbir  (3.sezon),Halit Ergenç Meryem Uzerli Vahide Perçin Nebahat Çehre Okan Yalabık Nur Fettahoğlu Selma Ergeç
Unutma Beni,,Mehmet Erişdi,,,,,,,Ankara,Focus Film,,,8,,19 Mayıs 2008 [1]  - 27 Mayıs 2016,Türkçe,,Nilgün Sağyaşar,40-60 dakika,,,,,,,1702 ( bölümleri listesi ),576i  ( 16:9 SDTV ) 1080i  ( HDTV ),,Aile Dram,Televizyon dizisi,,Türkiye,Stereo,Sona erdi,FOX  ( HD ),,,Moda Senaryo Evi,,,
Lise Devriyesi,Yahya Samancı,Kerem Şahenk,,,,,,Tuna Hizmetli,İstanbul,ARC Film,,Lise Devriyesi jenerik,1,,26 Mart 2017 - 18 Haziran 2017,Türkçe,,Fatih Enes Ömeroğlu,150 dakika,,Emre Boyraz Ahmet Yıldıran,,Fatih Enes Ömeroğlu,,,11,576i  ( 16:9 SDTV ) 1080i  ( HDTV ),,Gençlik Polisiye Komedi,Televizyon dizisi,,Türkiye,Stereo,Sona erdi,TRT 1,,,,Lise Devriyesi jenerik,,Ozan Dolunay Bahar Şahin İsmail Ege Şaşmaz Yusuf Gökhan Atalay Asena Tuğal Doğan Akdoğan Mehmet Çevik
Tatlı Betüş,Atıf Yılmaz,,,,,,,,,Delta Film,,,1,,3 Nisan 1993 - 29 Mayıs 1993,Türkçe,,,,,,,,,,8,Stereo,,,Televizyon dizisi,,Türkiye,,Sona erdi,Show TV,,,Aziz Nesin  (Eser) Ümit Ünal Atıf Yılmaz,,,Türkân Şoray Alp Buğdaycı Tarık Tarcan Faruk Peker Aydemir Akbaş Altan Akışık Bülent Kayabaş Taner Barlas Cem Davran
Artist Palas,Mahinur Ergun,,,,,,,,İstanbul,Protel,,Artist Palas Jenerik,1,,20 Mart 1994 - 15 Temmuz 1994,Türkçe,,Ali Taygun,40 dakika,Can Hakgüder,,,,,,12,480i  ( SDTV ),,Dram Romantik Komedi,Televizyon dizisi,,Türkiye,,Sona erdi,Kanal D,,,Mahinur Ergun,,,Zuhal Olcay Lale Mansur Burçin Orhon Füsun Demirel Hakan Tanfer
Avrupa Yakası,Hakan Algül (1-41)  Jale Atabey  (42-190),,,,,,,Cenk Durmazel Cenk Sarkuş,İstanbul  Plato stüdyoları,Plato Film,,,6,,11 Şubat 2004  ( 2004-02-11 )  -  24 Haziran 2009  ( 2009-06-24 ) [4],Türkçe,,Sinan Çetin,90 dakika [2]  73 dakika [3],,,,Gülse Birsel,,,190 [1]  ( bölümleri listesi ),4:3,,Durum komedisi,Televizyon dizisi,,Türkiye,Stereo,Sona erdi,atv  (2004-2009),,,,,,Gazanfer Özcan Hümeyra Müşfik Kenter Gönül Ülkü Ata Demirer Gülse Birsel Engin Günaydın Levent Üzümcü Şenay Gürler Bülent Polat Veysel Diker Yıldırım Öcek Yavuz Seçkin Hale Caneroğlu Evrim Akın Vural Çelik Hasibe Eren Tolga Çevik Sarp Apak Peker Açıkalın Binnur Kaya Hakan Yılmaz Ömür Arpacı Rutkay Aziz Suna Keskin  ve  diğerleri
Hizmetçiler,Metin Balekoğlu,,,,,,,Atakan Ilgazdağ,İstanbul,Fabrika Yapım,,,1,,7 Mart 2020 - 21 Mart 2020,Türkçe,,Öner Arslanel,130 dakika,,,,Ali Leskay,,,3,576i  ( 16:9 SDTV ) 1080i  ( HDTV ),,Drama Entrika,Televizyon dizisi,,Türkiye,Stereo,Yayından kaldırıldı,Kanal D,,,Makbule Kosif,,,Deniz Baysal Yurtcu Algı Eke Selen Domaç Aleyna Solaker
Yürek Çıkmazı,Serdar Gözelekli (1-15) Bahadır İnce (16-28),,,,,,,Serkan Ölçer Ece Ölçer,İstanbul,Gold Film,,,1,,1 Kasım 2022 - 13 Haziran 2023,Türkçe,,Faruk Turgut,120 dakika,,,,,,,28,576i  ( 16:9 SDTV ) 1080i  ( HDTV ),,Dram,Televizyon dizisi,Atike Hınçlıer,Türkiye,Stereo,Sona erdi,TRT 1,,Yürek Çıkmazı,Ayla Hacıoğulları (1-28) Vilmer Özçınar (1-28) Toprak Karaoğlu (20-28),,,Ayça Bingöl Alp Navruz İrem Helvacıoğlu Mesut Akusta
Aşk ve Günah,Atilla Cengiz Irmak Çengel,,,,,,,Sertaç Özgümüş,İstanbul,D Productions,,,1,,31 Ağustos 2015 - 19 Şubat 2016,Türkçe,,,,,,,,,,120,576i  ( 16:9 SDTV ) 1080i  ( HDTV ),,Aşk Drama,Televizyon dizisi,,Türkiye,Stereo,Sona erdi,Kanal D,,,Suna Tensi Sema Tensi,,,İlknur Şaşmazer Türkan Kılıç Seren Deniz Yalçın Tekin Temel
Gece Gündüz,Metin Balekoğlu Sarp Levendoğlu,,,,,,,,,,,,1,,4 Temmuz 2008 - 22 Mart 2009,Türkçe,,Mehmet Altıoklar,80 dakika,,,,,,,29,,,Komedi Polisiye Suç Dram,Televizyon dizisi,,Türkiye,Stereo,Sona erdi,Kanal D,,,,,,Sarp Levendoğlu Settar Tanrıöğen
Ben Onu Çok Sevdim,Mehmet Bahadır Er Eylem Koza,,,,,,,,"İstanbul ,  Türkiye",Pana Film,,"""Ben Onu Çok Sevdim Jenerik""",1,,10 Eylül 2013  ( 2013-09-10 )  -  24 Ocak 2014  ( 2014-01-24 ),Türkçe,,Raci Şaşmaz,90 dakika,,,,,,,15,576i  ( 16:9 SDTV ) 1080i  ( HDTV ),,Dram Politik,Televizyon dizisi,Seda Altaylı Ozan Aksungur,Türkiye,Stereo,Sona erdi,atv,,,,"""Nazende Sevgilim""",,Mehmet Aslantuğ İdil Fırat Birce Akalay Şemsi İnkaya Rıza Akın Erdinç Gülener Mehmetcan Mincinozlu Savaş Zafer Ege Aydan Kerem Alışık Devrim Yakut
Ver Elini Aşk,Bora Onur Deniz Yılmaz Hakan Eren,,,,,,,,İstanbul Gaziantep,Salacak Yapım,,,1,,7 Eylül 2017 - 3 Aralık 2017,Türkçe,,Ayça Aral Sarangil,140 dakika,,,,,,,11,576i  ( 16:9 SDTV ) 1080i  ( HDTV ),,Romantik komedi Aşk,Televizyon dizisi,,Türkiye,Stereo,Sona erdi,Kanal D,,,Ayşe Ferda Eryılmaz Nehir Erdem,,,Ali İl Sevda Erginci
Tek Türkiye,Naci Çelik Berksoy Gürsel Ateş,,,,,,,,Konya,,,,4,,18 Ekim 2007 - 30 Haziran 2011,Türkçe,,Salih Asan,90 dakika,,,,Salih Asan,,,149 ( bölümleri listesi ),,,Dram Aksiyon,Televizyon dizisi,,Türkiye,Stereo,Sona erdi,Samanyolu TV,,,Ali Kara Samim Utku,,,
Aziz Ahmet,,,,,,,,,,Med Yapım,,,1,,22 Nisan 1994 - 1994,Türkçe,,,,,,,,,,,576i  ( 16:9 SDTV ),,,Televizyon dizisi,,Türkiye,Stereo,Sona erdi,atv,,,,,,Uğur Yücel Ayşegül Aldinç
Geniş Aile,Ömer Uğur,,,,,,,,"Boyacıköy ,   İstanbul",D Productions,,Komşu Kızı,3,,8 Temmuz 2009 - 18 Kasım 2011,Türkçe,,Ahmet Kayumtu  (uygulayıcı)  Lale Eren,90 dakika,Gripin,,,,,Kanal D Home Video,108 ( bölümleri listesi ),576i  ( 16:9 SDTV ) 1080i  ( HDTV ),,Komedi Aile,Televizyon dizisi,,Türkiye,Stereo,Sona erdi,Kanal D  (2009-2010)  Star TV  (2010-2011),,,Cüneyt İnay Kamuran Süner,Komşu Kızı,Serdar Armutlu,Ufuk Özkan Zuhal Topal Rojda Demirer Rasim Öztekin Fırat Tanış Mine Teber İlker Ayrık
Serçe Sarayı,Mesude Erarslan Tekin  (1-5) Ömür Atay  (6-13),,,,,,,Ali Erkin Çakmak Murat Tükenmez,İstanbul,Endemol Shine Turkey Bazıfilmler,,,1,Necmettin Akdeniz,5 Mart 2015  ( 2015-03-05 )  -  14 Haziran 2015  ( 2015-06-14 ),Türkçe,,Kemal Kurçer Gökhan Tatarer Soysal Demir Hakan Eren,120 dakika,,,,,,,13 ( bölümleri listesi ),480i  ( SDTV ) 720p  ( HDTV ),,Drama Aşk,Televizyon dizisi,,Türkiye,Stereo,Sona erdi,Star TV  ( HD ),,,Mustafa Mutlu Arzu Daştan Mutlu Nuriye Bilici Rodi Güven Yalçınkaya Şebnem Çıtlak,,Ahmet Kasapoğlu Ümit Çakmaksoy,Songül Öden Mert Fırat Alican Yücesoy Esra Dermancıoğlu Selen Öztürk Serkan Ercan Erkan Bektaş Turgay Kantürk
Veda,Merve Girgin,,,,,,,Zülfü Livaneli,İstanbul,Medyapım,,,1,,27 Eylül 2012 - 23 Kasım 2012,Türkçe,,Fatih Aksoy,90 dakika,,,,,,,8,480i  ( SDTV ) 1080i  ( HDTV ),,Drama Aşk Tarihî,Televizyon dizisi,,Türkiye,Stereo,Yayından kaldırıldı,Kanal D  ( HD ),,,Sündüz Haşar,,Barış Milan,Mehmet Aslantuğ Fahriye Evcen Maral Üner Jale Arıkan Sevda Erginci Ahmet Tansu Taşanlar
Alemin Kıralı,Derya Yaruç Bülent İşbilen,İnci Kırhan Asena Bülbüloğlu Ali Gündoğdu,,,,,Gizem Erbirer,Günay Uysal,İstanbul,Süreç Film,,Alemin Kıralı jenerik,2,Kemal Aslan Ömer Kılınç,16 Eylül 2011 - 27 Mart 2013,Türkçe,Ali Rıza Başaran,Ali Gündoğdu,90 dakika,Kadıköy Acil,,,,,,67,576i  ( 16:9 SDTV ) 1080i  ( HDTV ),,Aile Durum komedisi Absürt komedi,Televizyon dizisi,,Türkiye,Stereo,Sona erdi,atv,,,Kemal Kenan Ergen Kamuran Süner,Alemin Kıralı jenerik,Tevfik Şenol,Oya Başar Şafak Sezer Evrim Akın Metin Yıldız Zeynep Gülmez Ececan Gümeci  Hamdi Kahraman Elvin Levinler Birsu Demir Yağmur Ün
Zengin Kız Fakir Oğlan,Hasan Tolga Pulat,,,,,,,,İstanbul,Mint Prodüksiyon,,Nihavend Longa - Her Devrin Hikâyesi (Burcu Güven),4,FSM Film Teknik,30 Ağustos 2012 - 28 Ağustos 2015,Türkçe Azerice,,Birol Güven,110 dakika,Aydın Sarman,,,,,,136,576i  ( 16:9 SDTV ) 1080i  ( HDTV ),,Aile Romantik komedi,Televizyon dizisi,,Türkiye,Stereo,Sona erdi,TRT 1  ( HD ) (2012-2015) FOX  ( HD ) (2015),,,Birol Güven  (1-136.Bölüm)  Yaşar Arak  (1-136.Bölüm)  Caner Güler  (1-136.Bölüm)  Metin Açıkgöz  (1-90.Bölüm),,,Hüseyin Avni Danyal Ayda Aksel Ufuk Özkan Ecem Özkaya Mahir İpek Gözde Okur Kemal Kuruçay Şeyla Halis Ferdi Akarnur Zerrin Epikmen Kıvanç Baran Arslan
İşler Güçler,Selçuk Aydemir,,,,,,,,İstanbul,Limon Film,,Tolga Çebi -  Peh Peh Peh,1,,28 Haziran 2012 - 4 Haziran 2013,Türkçe,Aykut Yıldırım,Hayri Aslan,75 dakika,Tolga Çebi,,,,,,41 ( bölümleri listesi ),576i  ( 16:9 SDTV ) 1080i  ( HDTV ),,Komedi,Televizyon dizisi,,Türkiye,Stereo,Sona erdi,Star TV  ( HD ),,,Selçuk Aydemir Osman Edip Tekin Onay Durgun,,Özgür Polat Ömer Yılmaz,Ahmet Kural Murat Cemcir Sadi Celil Cengiz
Gecenin Ucunda,Barış Erçetin,,,,,,,,İstanbul,TMC Film Âlim Yapım,,,1,,5 Ekim 2022 - 25 Nisan 2023,Türkçe,,Erol Avcı Kadir Doğulu,120 dakika,,,,,,,26,16:9 1080p,,Dram Romantik,Televizyon dizisi,,Türkiye,Stereo,Sona erdi,Star TV,,Peride Celal  -  Gecenin Ucunda,Başar Başaran Emre Özdür,,,Neslihan Atagül Kadir Doğulu Tuba Ünsal Sarp Levendoğlu
Ev Yapımı,Birol Güven,,,,Seksenler  (2012-2022),,,,İstanbul,MinT Yapım,,,1,,9 Nisan 2020 - 11 Haziran 2020,Türkçe,,Birol Güven,60 dakika,,,,,,,13,576i  ( SDTV 16:9 ) 1080i  ( HDTV ),,Komedi,Televizyon dizisi,,Türkiye,Stereo,Sona erdi,TRT 1,,,Birol Güven,,,Rasim Öztekin Özlem Türkad Ayşe Tolga Şoray Uzun Yasemin Çonka Berat Yenilmez Begüm Öner Ceyhun Fersoy
Hekimoğlu,Hülya Gezer  (1-24) Semih Bağcı  (15-24) Emre Aybek (25-51),,,,,,,Tuna Hizmetli,İstanbul/Tuzla Okan Üniversitesi ve Okan Üniversitesi Hastanesi,Karga Seven Pictures OJO Pictures,,,2,,17 Aralık 2019 - 25 Mayıs 2021,Türkçe,,Ömer Özgüner Ümmü Burhan Kerem Çatay,130 dakika,Tuna Hizmetli,,,,,,51 ( bölümleri listesi ),576i  ( 16:9 SDTV ) 1080i  ( HDTV ),,Medikal Drama Komedi,Televizyon dizisi,,Türkiye,Stereo,Sona erdi,Kanal D,,House M.D.,Banu Kiremitçi Bozkurt (1-14) Neşe Şen (15-25) Elif Benan Tüfekçi (26-33) Esed Akçilad (34-41) Murat Taşkent (42-51),,,Timuçin Esen Okan Yalabık Ebru Özkan Kaan Yıldırım Aytaç Şaşmaz Damla Colbay
Seher Vakti,Çağatay Tosun,,,,,,,,,,,,1,,31 Ocak 2005 - 28 Mart 2005,Türkçe,,Abdullah Oğuz D YAPIM,,,,,,,,8,4:3,,,Televizyon dizisi,Gül Dirican,Türkiye,Stereo,Sona erdi,Kanal D  (2005),,,,,,Yeşim Salkım Uğur Polat İdil Fırat Berk Hakman Begüm Birgören
Güneydoğudan Öyküler Önce Vatan,Onur Tan,,,,,,,,İstanbul,Fida Film,,,1,,20 Ekim 2010 - 30 Aralık 2010,Türkçe,,Murat Akdilek,,,,,,,,11,4:3,,Dram Savaş,Televizyon dizisi,,Türkiye,Stereo,Yayından kaldırıldı,Show TV,,,Hakan Evrensel,,,Melisa Sözen Serhat Tutumluer Umut Kurt Sezai Aydın İlker Kızmaz Arsen Gürzap Yeliz Akkaya Nihan Okutucu
Güzel Köylü,Mustafa Şevki Doğan,,,,,,,,"Bozüyük ,  Muğla İstanbul",Gold Film,,,1,,25 Haziran 2014 - 17 Haziran 2015,Türkçe,,Faruk Turgut,120 dakika,,,,,,,52 ( bölümleri listesi ),576i  ( 16:9 SDTV ) 1080i  ( HDTV ),,Aile Romantik komedi,Televizyon dizisi,,Türkiye,Stereo,Sona erdi,Star TV,,,Baykut Badem Filiz Ekinci Berk Can Doğan,,,Gizem Karaca Berk Cankat Mehmet Ali Nuroğlu Zerrin Sümer Ahmet Mümtaz Taylan Ali İpin
Sırlar Dünyası,Taner Tunç Avni Kütükoğlu Şenol Sönmez,,Reha Yeprem,,,,,,,,,,5,,13 Nisan 2004  ( 2004-04-13 ) [1] [2]  -  31 Ağustos 2010  ( 2010-08-31 ) [3] [4],Türkçe,,Mustafa Kartal Ahmet Gül,,Aria Ekrem Düzgünoğlu,,,,,,132,,,Dram,Televizyon programı,,Türkiye,Stereo,Sona erdi,Samanyolu TV,,,Mehmet Uyar Serkan Birlik Sedat Bilgin,,,
Sokak Şarkıcıları,Nazmi Özer,,,,,,,,İzmir,Yeni Stüdyo,Laboratuvar : Abdullah Akdeniz Hasan Örnek İsmet Karslı Renklendirme : Türker Vatan Işık : Erol Batıbeki Ses Kayıt : Erol Batıbeki,,1,Can Özer Kazım Çakırmanoğlu,1974 - 1974,Türkçe,,,,,,,,,,,,,,Dizi,,Türkiye,,,TRT,,,Alpay İzer,,Salih Dikişçi,Ali Poyrazoğlu Oya Başar Aysun Güven Özcan Özgür Gülşen Gürsoy İlhan Daner Alpay İzer
İçimdeki Fırtına,Doğan Ümit Karaca,,,,,,,Ender Akay Sunay Özgür,İstanbul,Aslan Yapım,,,1,,11 Şubat 2017  ( 2017-02-11 )  -  18 Mart 2017  ( 2017-03-18 ),Türkçe,,Kazım Uğur Kızılaslan Selman Kızılaslan,120 dakika,,,,,,Star TV,6,16:9,,Aksiyon Dram,Televizyon dizisi,,Türkiye,Stereo,Sona erdi,Star TV  ( HD ),,,Yazı'hane,,Özgür Polat,Merve Boluğur Yusuf Çim Gizem Karaca Burak Yamantürk Tarık Papuççuoğlu Mehmet Özgür Hatice Aslan
Boynu Bükükler,Ömer Uğur,,,,,,,,"İstanbul ,  Türkiye",Barakuda Film,,,1,,27 Şubat 2014 - 12 Nisan 2014,Türkçe,,Ahmet Kayımtu Mahmut Kayımtu,,Sertaç Özgümüş Selim Siyami Sümer,,,Uğur Bayar,,,7,576i  ( 16:9 SDTV ) 1080i  ( HDTV ),,Komedi Gençlik,Televizyon dizisi,,Türkiye,Stereo,Sona erdi,Kanal D  ( HD ),,,Cüneyt İnay,,,Sedef Avcı Ahmet Saraçoğlu Murat Akkoyunlu Ünal Yeter Barış Başar Ali Tutal Mine Teber Ahmet Olgun Sünear Çağlar Ertuğrul Gün Koper Güven Murat Akpınar Bora Akkaş Bensu Soral Sevilay Şimşek Özüm Arkan Öznur Serçeler Barış Aytaç Cüneyt Çeliksoy Bengi İdil Uras Nihan Tarhan Anıl Altan Kadir İlter
Pars: Narkoterör,Metin Günay,,,,,,,,,Sinegraf,,,1,,21 Ocak 2008 - 4 Temmuz 2008,Türkçe,,Osman Sınav,90 dakika,Gökhan Kırdar,,,,,,23,4:3,,Aksiyon Politik Dram Macera,Televizyon dizisi,,Türkiye,Stereo,Sona erdi,Show TV,,,Aybars Bora Kahyaoğlu Selman Kılıçaslan Onur Şener,,Tevfik Şenol,İbrahim Çelikkol Seda Bakan
Süper Babaanne,Serkan Kızıldağ Temel Gürsu,,,,,,,,,TRT Avşar Film,,,1,,2008,Türkçe,,Şükrü Avşar,90 dakika,,,,,,,17,,,Fantastik Aile Komedi,Televizyon dizisi,,Türkiye,Stereo,Sona erdi,TRT 1,,,Gani Müjde Gökhan Karagülle,,,Murat Kubilay Asuman Dabak Mustafa Uzunyılmaz Ceren Soylu Yılmaz Köksal Zuhal Yalçın Nedret Özbek
